{
  "captured_at": "2026-07-18T14:15:00Z",
  "claim_tested": "The earlier local proof already met the narration-naturalness and caption-safe layout quality required for a delivery-grade code explainer.",
  "collector": "human:repository-owner",
  "content_hash": "sha256:d93fa9554a6eab4412675175f929fea8dadc2bd581132f4698a1265bc521816d",
  "directness": "direct",
  "evidence_id": "E-HUMAN-MEDIA-DEFECTS-001",
  "freshness": {
    "expires_at": "2026-08-17T14:15:00Z",
    "policy": "source_specific"
  },
  "hypothesis_refs": [
    "H-FEASIBILITY-001"
  ],
  "limitations": [
    "The reviewed proof targets the earlier graph-video feasibility snapshot, not TEMPO commit 4afc6a3.",
    "The observation comes from one repository owner rather than an independent target learner.",
    "The feedback identifies visible delivery defects but does not isolate the speech engine, encoding, typography, or layout root cause.",
    "This record contradicts delivery quality only; it does not negate that a playable technical proof existed."
  ],
  "measurements": [
    {
      "metric": "Human-approved natural narration sample",
      "unit": "boolean",
      "value": false
    },
    {
      "metric": "Human-reported caption overlap with diagrams",
      "unit": "boolean",
      "value": true
    },
    {
      "metric": "Delivery-grade media review passed",
      "unit": "boolean",
      "value": false
    }
  ],
  "provenance": {
    "collection_method": "Repository-owner playback review of the hash-bound local proof followed by direct defect feedback in the active Codex conversation.",
    "is_fixture": false,
    "kind": "external",
    "untrusted_input": true
  },
  "sample_context": {
    "description": "One human quality review of the existing local graph-to-video proof.",
    "population": "Repository owner/developer; not an independent target learner.",
    "sample_size": 1
  },
  "source_reference": "conversation://repository-owner/2026-07-18/audio-caption-review",
  "source_type": "experiment_result",
  "stance": "contradicts"
}
