{
  "captured_at": "2026-07-18T02:40:41Z",
  "claim_tested": "The repository owner reports that five developer text-versus-video comparisons were completed and that the video explanation was more reading-friendly overall.",
  "collector": "human:repository-owner",
  "content_hash": null,
  "directness": "indirect",
  "evidence_id": "E-REPORTED-LEARNING-COMPARISON-001",
  "freshness": {
    "expires_at": "2026-10-16T02:40:41Z",
    "policy": "source_specific"
  },
  "hypothesis_refs": [
    "H-LEARNING-001"
  ],
  "limitations": [
    "No individual observation records, answers, timings, consent or eligibility confirmations, or protocol-deviation notes were supplied with the aggregate report.",
    "More reading-friendly is a qualitative conclusion and is not equivalent to the predeclared video-win rule based on correctness and completion time.",
    "This aggregate report cannot satisfy the observed-user-behavior threshold for H-LEARNING-001 until five anonymous raw observations are compiled by the registered experiment tool.",
    "Participant-level contradictory or negative outcomes cannot be assessed from the aggregate conclusion."
  ],
  "measurements": [
    {
      "metric": "Completed developer text-versus-video comparisons",
      "unit": "comparisons (user-reported aggregate)",
      "value": 5
    },
    {
      "metric": "Aggregate qualitative conclusion favored video for reading friendliness",
      "unit": "repository-owner report",
      "value": true
    }
  ],
  "provenance": {
    "collection_method": "Repository-owner statement in the active Codex conversation; no participant-level raw records were supplied.",
    "is_fixture": false,
    "kind": "external",
    "untrusted_input": true
  },
  "sample_context": {
    "description": "Repository owner reports five completed developer comparisons and an aggregate qualitative conclusion that video was more reading-friendly.",
    "population": "Five developers reported by the repository owner; individual eligibility, repository familiarity, and task conditions are not independently verifiable",
    "sample_size": 5
  },
  "source_reference": "conversation://repository-owner/2026-07-18/reported-learning-comparison-complete",
  "source_type": "customer_interview",
  "stance": "supports"
}
