{
  "evidence_id": "E-INTERVIEW-B",
  "source_type": "customer_interview",
  "source_reference": "fixture://synthetic-interview-b",
  "captured_at": "2026-07-17T12:45:00Z",
  "freshness": {"policy": "default", "expires_at": "2030-12-31T23:59:59Z"},
  "content_hash": null,
  "claim_tested": "A product lead will accept structured governance rather than relying on an approval message.",
  "stance": "contradicts",
  "directness": "direct",
  "sample_context": {"description": "Synthetic judge fixture representing a skeptical interview", "sample_size": 1, "population": "Fictional product lead"},
  "collector": "platform:demo-fixture-signer",
  "limitations": ["Synthetic fixture", "Counterevidence is intentionally retained to exercise acknowledgement"],
  "hypothesis_refs": ["H-PROBLEM-001"],
  "measurements": [
    {"metric": "Target users reporting both a recent failure and intent to use the workflow", "value": 0, "unit": "of 5 interviews"}
  ],
  "provenance": {"kind": "fixture", "collection_method": "Hand-authored deterministic demo input", "is_fixture": true, "untrusted_input": true}
}
