{
  "evidence_id": "E-INTERVIEW-A",
  "source_type": "customer_interview",
  "source_reference": "fixture://synthetic-interview-a",
  "captured_at": "2026-07-17T12:30:00Z",
  "freshness": {"policy": "default", "expires_at": "2030-12-31T23:59:59Z"},
  "content_hash": null,
  "claim_tested": "A product lead can identify a recent premature build and wants a bounded agent handoff.",
  "stance": "supports",
  "directness": "direct",
  "sample_context": {"description": "Synthetic judge fixture representing four interview observations", "sample_size": 4, "population": "Fictional product leads"},
  "collector": "platform:demo-fixture-signer",
  "limitations": ["Synthetic fixture", "Must never be represented as customer validation"],
  "hypothesis_refs": ["H-PROBLEM-001"],
  "measurements": [
    {"metric": "Target users reporting both a recent failure and intent to use the workflow", "value": 4, "unit": "of 5 interviews"}
  ],
  "provenance": {"kind": "fixture", "collection_method": "Hand-authored deterministic demo input", "is_fixture": true, "untrusted_input": true}
}
